[
  {
    "source_pdf": "c08504822.pdf",
    "brand": "HP",
    "model": "ProBook 450 15.6 inch G10",
    "processor": [
      "Intel® Core™ i3-1340P 13th Generation",
      "Intel® Core™ i5-1334U 13th Generation",
      "Intel® Core™ i5-1335U 13th Generation",
      "Intel® Core™ i5-1340P 13th Generation",
      "Intel® Core™ i5-1345U 13th Generation",
      "Intel® Core™ i7-1355U 13th Generation",
      "Intel® Core™ i7-1360P 13th Generation"
    ],
    "memory": [
      "32GB DDR4-3200 MHz RAM"
    ],
    "storage": [
      "128GB up to 512GB PCIe NVMe Value SSD",
      "Up to 1TB PCIe NVMe M.2 SSD TLC"
    ],
    "display": [
      {
        "size": "15.6 inches (39.6cm)",
        "resolution": "1920x1080",
        "brightness": "400 nits",
        "touch": true,
        "anti_glare": true,
        "panel_type": "Not specified",
        "refresh_rate": "Not specified"
      }
    ],
    "graphics": [
      "Intel® UHD Graphics (Integrated)",
      "NVIDIA® GeForce RTX™ 2050 Laptop GPU (4 GB GDDR6 dedicated)"
    ],
    "battery": [
      "HP 3-Cell 42Wh Li-ion polymer",
      "HP 3-Cell 51Wh Li-ion polymer"
    ],
    "weights": {
      "variant_1": {
        "sku_id": "HP450G10-Standard",
        "top_material": "Not specified",
        "bottom_material": "Not specified",
        "weight": "1.79 kg",
        "weight_lbs": "3.95 lbs"
      }
    },
    "dimensions": "35.94 x 23.39 x 1.99 cm",
    "ports": [
      "USB-C®",
      "USB-A®",
      "HDMI 2.1",
      "DisplayPort™",
      "RJ-45 (Ethernet)",
      "Headphone/Microphone combo jack"
    ],
    "wireless": {
      "wifi_6": false,
      "wifi_6e": true,
      "wifi_5": false,
      "bluetooth": true,
      "bluetooth_version": "5.3"
    },
    "operating_system": [
      "Windows 11 Home",
      "Windows 11 Home Single Language",
      "Windows 11 Pro",
      "Windows 11 Pro Education",
      "Windows 11 Enterprise",
      "Windows 10 Pro",
      "Windows 10 Enterprise",
      "FreeDOS"
    ],
    "security": [
      "TPM 2.0",
      "Fingerprint reader/sensor",
      "IR Camera",
      "HP Wolf Pro Security Edition"
    ],
    "multi_media": {
      "camera": [
        "5MP camera with 88° field of view",
        "720p HD camera with temporal noise reduction",
        "IR camera"
      ],
      "camera_privacy": true,
      "audio": [
        "Dual stereo speakers",
        "Dual array microphone"
      ]
    },
    "monitor": {
      "max_displays": "Not specified",
      "supported_resolutions": [],
      "hdmi_support": "Not specified",
      "usbc_support": "Not specified",
      "thunderbolt_support": "Not specified"
    },
    "chipset": "Not specified",
    "colour": [
      "Pike silver"
    ],
    "case_material": "Aluminum",
    "network": {
      "ethernet": "Gigabit Ethernet",
      "wwan": [
        "Wireless 4G LTE",
        "CAT16 WWAN",
        "5G"
      ],
      "nfc": false
    },
    "warranty": [
      {
        "duration": "1 year",
        "type": "Limited warranty"
      },
      {
        "duration": "3 years",
        "type": "Limited warranty"
      },
      {
        "duration": "90 days",
        "type": "Software warranty"
      }
    ],
    "certification": [
      "CECP",
      "EPEAT",
      "SEPA",
      "ENERGY STAR®",
      "Taiwan Green Mark",
      "TCO Certified"
    ],
    "input_device": {
      "keyboard": [
        "HP Premium Keyboard",
        "Spill-resistant",
        "Backlit",
        "Numeric keypad"
      ],
      "touchpad": "Clickpad",
      "pointing_device": "Not specified"
    },
    "power": {
      "adapter_wattage": [
        "45W USB Type-C adapter",
        "65W USB Type-C adapter",
        "45W EM External AC power adapter",
        "65W EM External AC power adapter"
      ],
      "power_delivery": "USB-C Power Delivery",
      "rapid_charge": "Not specified"
    }
  },
  {
    "source_pdf": "c08947328.pdf",
    "brand": "HP",
    "model": "ProBook 440 14 inch G11",
    "processor": [
      "Intel® Core™ Ultra 5 125H processor",
      "Intel® Core™ Ultra 5 155H processor",
      "Intel® Core™ Ultra 7 125H processor",
      "Intel® Core™ Ultra 7 155H processor"
    ],
    "memory": [
      "48GB DDR5-5600 MT/s"
    ],
    "storage": [
      "Up to 256 GB PCIe® NVMe™ Value SSD",
      "512 GB up to 1 TB PCIe® Gen4x4 NVMe™ M.2 SSD"
    ],
    "display": [
      {
        "size": "14 inches (35.6cm)",
        "resolution": "1920x1200",
        "brightness": "400 nits",
        "touch": true,
        "anti_glare": true,
        "panel_type": "Not specified",
        "refresh_rate": "Not specified"
      }
    ],
    "graphics": [
      "Intel® Graphics (Integrated)",
      "NVIDIA® GeForce RTX™ 2050 Laptop GPU (4 GB GDDR6 dedicated)"
    ],
    "battery": [
      "HP 3-Cell 56Wh Li-ion polymer"
    ],
    "weights": {
      "variant_1": {
        "sku_id": "HP440G11-Standard",
        "top_material": "Not specified",
        "bottom_material": "Not specified",
        "weight": "1.39 kg",
        "weight_lbs": "3.06 lbs"
      }
    },
    "dimensions": "31.86 x 22.44 x 1.70 cm",
    "ports": [
      "USB-C®",
      "USB-A®",
      "HDMI 2.1",
      "DisplayPort™",
      "RJ-45 (Ethernet)",
      "Stereo headphone/microphone combo jack"
    ],
    "wireless": {
      "wifi_6": false,
      "wifi_6e": true,
      "wifi_5": false,
      "bluetooth": true,
      "bluetooth_version": "5.3"
    },
    "operating_system": [
      "Windows 11 Home",
      "Windows 11 Pro",
      "Windows 11 Pro Education",
      "Windows 11 Enterprise",
      "Windows 10 Enterprise",
      "FreeDOS"
    ],
    "security": [
      "TPM 2.0 Embedded Security Chip",
      "Fingerprint reader/sensor",
      "IR camera",
      "HP Wolf Pro Security Edition"
    ],
    "multi_media": {
      "camera": [
        "FHD camera",
        "5MP IR camera"
      ],
      "camera_privacy": true,
      "audio": [
        "Audio by Poly",
        "Dual stereo speakers with discrete amplifiers",
        "Dual array microphones"
      ]
    },
    "monitor": {
      "max_displays": "Not specified",
      "supported_resolutions": [],
      "hdmi_support": "Not specified",
      "usbc_support": "Not specified",
      "thunderbolt_support": "Not specified"
    },
    "chipset": "Not specified",
    "colour": [
      "Pike silver"
    ],
    "case_material": "Aluminum",
    "network": {
      "ethernet": "RJ-45 Gigabit Ethernet",
      "wwan": [
        "Wireless 4G LTE",
        "CAT16 WWAN",
        "Mobile broadband",
        "5G"
      ],
      "nfc": false
    },
    "warranty": [
      {
        "duration": "1 year",
        "type": "Limited warranty"
      },
      {
        "duration": "90 days",
        "type": "Software limited warranty"
      }
    ],
    "certification": [
      "EPEAT",
      "TCO Certified",
      "GS Marks",
      "WW RoHS",
      "CE",
      "ENERGY STAR®",
      "Taiwan BSMI/NCC",
      "Korea KCC/KC/KES",
      "Saudi Arabian Compliance",
      "EAEU Compliance",
      "Ukraine NSoC/TEC",
      "China CCC/SRRC"
    ],
    "input_device": {
      "keyboard": [
        "Spill-resistant",
        "Optional backlit",
        "DuraKeys"
      ],
      "touchpad": "Microsoft Precision Touchpad with multi-touch gesture support",
      "pointing_device": "Clickpad"
    },
    "power": {
      "adapter_wattage": [
        "45W USB Type-C® adapter",
        "65W USB Type-C® adapter",
        "65W USB Type-C® Halogen-free adapter",
        "100W USB Type-C® slim adapter"
      ],
      "power_delivery": "USB-C Power Delivery",
      "rapid_charge": "Not specified"
    }
  },
  {
    "source_pdf": "ThinkPad_E14_Gen_5_AMD_Spec.pdf",
    "brand": "Lenovo",
    "model": "ThinkPad E14 Gen 5 (AMD)",
    "processor": [
      "AMD Ryzen™ 3 7330U (6 Cores / 16 Threads)",
      "AMD Ryzen™ 5 5625U (6 Cores / 12 Threads)",
      "AMD Ryzen™ 5 7430U (6 Cores / 12 Threads)",
      "AMD Ryzen™ 5 7530U (4 Cores / 8 Threads)",
      "AMD Ryzen™ 7 7730U (6 Cores / 12 Threads)"
    ],
    "memory": [
      "8GB DDR4-3200",
      "16GB DDR4-3200",
      "Up to 40GB (8GB soldered + 32GB SO-DIMM) DDR4-3200"
    ],
    "storage": [
      "128GB M.2 2242 SSD, PCIe® NVMe® 3.0",
      "256GB M.2 2242 SSD, PCIe® NVMe® 4.0",
      "512GB M.2 2242 SSD, PCIe® NVMe® 4.0",
      "1TB M.2 2280 SSD, PCIe® NVMe® 4.0"
    ],
    "display": [
      {
        "size": "14 inches",
        "resolution": "1920x1200",
        "brightness": "300 nits",
        "touch": false,
        "anti_glare": true,
        "panel_type": "IPS",
        "refresh_rate": "60 Hz"
      },
      {
        "size": "14 inches",
        "resolution": "1920x1200",
        "brightness": "300 nits",
        "touch": true,
        "anti_glare": true,
        "panel_type": "IPS",
        "refresh_rate": "60 Hz"
      },
      {
        "size": "14 inches",
        "resolution": "2200x1440",
        "brightness": "300 nits",
        "touch": false,
        "anti_glare": true,
        "panel_type": "IPS",
        "refresh_rate": "60 Hz"
      }
    ],
    "graphics": [
      "AMD Radeon™ Graphics (Integrated, Shared Memory, DirectX® 12)"
    ],
    "battery": [
      "47Wh Rechargeable Li-ion Battery",
      "57Wh Rechargeable Li-ion Battery"
    ],
    "weights": {
      "variant_1": {
        "sku_id": "E14G5AMD-AL-PCABS",
        "top_material": "Aluminium",
        "bottom_material": "PC-ABS",
        "weight": "1.41 kg",
        "weight_lbs": "3.11 lbs"
      },
      "variant_2": {
        "sku_id": "E14G5AMD-AL-AL",
        "top_material": "Aluminium",
        "bottom_material": "Aluminium",
        "weight": "1.43 kg",
        "weight_lbs": "3.15 lbs"
      }
    },
    "dimensions": "313 x 219.3 x 17.99 mm",
    "ports": [
      "USB-C® 3.2 Gen 2 (data transfer, Power Delivery 3.0, DisplayPort™ 1.4)",
      "USB-C® 3.2 Gen 1 (data transfer, Power Delivery 3.0, DisplayPort™ 1.4)",
      "USB 3.1 Gen 1",
      "HDMI® 1.4b",
      "RJ-45 (Ethernet)",